{
  "tenant_id": "tenant_123",
  "surface": "provider_directory",
  "result_scope": [
    "provider_profile"
  ],
  "query_text": "generic service keyword",
  "filters": {
    "and": [
      {
        "field": "service_category_id",
        "op": "eq",
        "value": "cat_123"
      },
      {
        "field": "location.distance_km",
        "op": "lte",
        "value": 20
      }
    ]
  },
  "facets": [
    "service_category_id",
    "location_area",
    "availability_window"
  ],
  "sort": "relevance",
  "page_size": 20,
  "cursor": null
}
